task_id,project_id,assignee_id,description,priority,status,due_date
T00317,P0168,E00382,Guess item scene push upon benefit.,High,In Progress,2025-09-03
T00318,P0123,E00487,Again child charge scientist color.,Low,Completed,2024-12-13
T00319,P0148,E00460,I knowledge condition how.,Medium,Open,2025-04-14
T00320,P0084,E00043,Son evidence sign cell development project either.,Medium,In Progress,2025-03-05
T00321,P0118,E00228,Base sign act find six.,Medium,Blocked,2025-08-01
T00322,P0080,E00099,Director life ask.,Low,In Progress,2025-06-24
T00323,P0044,E00309,Investment their name country.,High,In Progress,2024-12-25
T00324,P0066,E00241,Worry teacher if culture phone.,Medium,Blocked,2025-03-06
T00325,P0035,E00292,Public back commercial.,Medium,Open,2025-05-10
T00326,P0143,E00463,Among sister bring investment collection quite sea.,High,In Progress,2025-09-27
T00327,P0146,E00024,Claim store trip key everything body perhaps.,Medium,Completed,2025-01-15
T00328,P0034,E00450,Significant would community.,Low,In Progress,2025-05-21
T00329,P0110,E00139,Possible forward wall home hot bed.,Low,In Progress,2025-01-05
T00330,P0075,E00454,General message environment serious.,Low,Completed,2025-01-27
T00331,P0089,E00276,Sell high actually leader.,Low,In Progress,2025-04-13
T00332,P0116,E00103,Fly free loss message plant yet.,High,Open,2025-01-01
T00333,P0074,E00160,Sit any north too sometimes major interesting instead.,Low,Open,2025-02-24
T00334,P0107,E00281,Artist thus case young magazine piece.,Medium,In Progress,2025-04-19
T00335,P0108,E00297,Matter fly small his.,High,Completed,2025-03-22
T00336,P0147,E00217,Risk attorney politics maybe say appear cultural.,Medium,Open,2025-04-04
T00337,P0144,E00432,Check east chance trial color respond middle.,Medium,Blocked,2025-05-08
T00338,P0034,E00078,Pm impact model name.,Low,In Progress,2025-07-26
T00339,P0155,E00024,Move when size take professional and agent.,Low,Open,2024-10-19
T00340,P0194,E00116,Game style hold just.,Medium,Open,2024-11-18
T00341,P0198,E00448,Recognize approach may.,High,In Progress,2025-05-06
T00342,P0118,E00281,Onto southern event.,High,Open,2025-06-26
T00343,P0036,E00246,Capital quickly spend run.,High,Blocked,2025-07-26
T00344,P0003,E00210,Ahead capital actually same represent.,Low,Blocked,2025-01-20
T00345,P0190,E00418,Anyone whose campaign Republican.,Low,Completed,2025-06-26
T00346,P0107,E00128,Street movement in Democrat live wind.,High,Completed,2025-01-20
T00347,P0082,E00408,Report article tend result sit field.,Low,Completed,2025-10-01
T00348,P0013,E00197,Whole happy during hold before again.,Low,Blocked,2024-12-15
T00349,P0084,E00174,Agreement rate back dinner because will.,High,Completed,2025-04-17
T00350,P0039,E00181,Total nothing police claim explain.,Medium,Open,2024-11-12
T00351,P0115,E00308,Mean figure computer keep economy lay.,Low,Blocked,2024-10-25
T00352,P0099,E00022,Number summer environment level.,Medium,In Progress,2025-04-14
T00353,P0114,E00444,Person soldier billion art region consider.,Low,Open,2025-07-31
T00354,P0117,E00382,Front born move politics trouble.,Low,In Progress,2024-11-15
T00355,P0128,E00100,Agency series sometimes safe his forget.,High,In Progress,2025-03-29
T00356,P0131,E00313,Radio source chance whether field effect.,Medium,Blocked,2025-08-07
T00357,P0115,E00208,Game church power.,Medium,Blocked,2024-11-19
T00358,P0114,E00332,Guy agree also happen.,Low,Completed,2025-07-08
T00359,P0045,E00448,Commercial baby west speak manager according another.,Low,Open,2025-05-03
T00360,P0143,E00475,Other wish beat trip hundred.,Medium,In Progress,2024-10-25
T00361,P0120,E00479,Allow establish past mission evening style ask.,High,Open,2025-04-17
T00362,P0078,E00397,Development hair able measure environment tough.,Medium,Open,2024-11-10
T00363,P0139,E00078,Cut early me parent.,High,Blocked,2024-12-25
T00364,P0146,E00267,Family focus tax concern color blood know.,High,In Progress,2025-08-04
T00365,P0013,E00047,Majority job nice cup southern majority ok.,High,Open,2025-05-12
T00366,P0023,E00169,Bed explain crime herself.,Low,Blocked,2025-06-29
T00367,P0147,E00217,Its pretty party end wind range food.,Medium,Blocked,2025-09-22
T00368,P0024,E00095,Hold where rich cost start new body.,Medium,In Progress,2024-12-13
T00369,P0068,E00192,Traditional event traditional source.,High,In Progress,2025-07-31
T00370,P0003,E00060,Involve marriage Mrs eight help become.,Medium,In Progress,2025-02-28
T00371,P0140,E00249,Certainly individual stop PM economic.,Medium,Blocked,2025-07-14
T00372,P0154,E00236,War notice officer place thank account.,High,Completed,2025-07-19
T00373,P0049,E00295,See right question able author worker.,Medium,Open,2024-10-19
T00374,P0162,E00320,Eight smile capital owner every.,High,Blocked,2024-12-17
T00375,P0026,E00276,Information investment Mr control various tell seven.,Low,Completed,2025-02-18
T00376,P0197,E00278,Inside idea know class position task traditional.,Low,Blocked,2025-05-09
T00377,P0185,E00440,Charge happy current ten along understand week.,High,In Progress,2025-01-17
T00378,P0053,E00213,Drug drop amount spend room hope.,High,Open,2025-05-29
T00379,P0174,E00033,Stage president rate.,High,In Progress,2025-01-05
T00380,P0107,E00362,Adult sport recognize then audience mention job.,Medium,In Progress,2025-06-19
T00381,P0181,E00023,Describe than record city determine push increase.,Medium,Open,2025-06-05
T00382,P0087,E00087,Ok situation management clearly my.,High,Blocked,2025-05-06
T00383,P0018,E00246,Yourself two work not hard safe.,Medium,Completed,2025-08-07
T00384,P0091,E00135,Property represent special particularly book move pick.,Medium,Open,2025-09-01
T00385,P0061,E00139,Industry care recently those.,High,Blocked,2024-10-30
T00386,P0006,E00327,Rate image nothing structure ago involve.,Medium,Blocked,2025-08-14
T00387,P0169,E00362,Recently free join attorney by western but.,Medium,Open,2024-10-11
T00388,P0042,E00430,Election type development night within.,Medium,Completed,2024-10-15
T00389,P0179,E00274,Bank cause election better human.,Medium,Completed,2025-06-27
T00390,P0003,E00337,Table marriage history pretty health.,Medium,Completed,2025-01-16
T00391,P0034,E00023,Fast perform court democratic effort.,Medium,Blocked,2024-10-17
T00392,P0009,E00440,Politics road social discussion.,Low,Completed,2025-05-19
T00393,P0005,E00368,On final painting.,Low,In Progress,2025-08-04
T00394,P0084,E00175,Grow evening blood information skin.,Low,Completed,2025-05-23
T00395,P0073,E00240,Know including collection standard security.,Medium,Blocked,2025-01-12
T00396,P0108,E00369,Third rather can first catch contain.,Low,In Progress,2024-10-18
T00397,P0079,E00470,Try live wish two.,High,Open,2025-01-21
T00398,P0059,E00068,Each down least themselves.,Low,Blocked,2025-05-27
T00399,P0106,E00148,There could fine risk knowledge policy make.,High,Blocked,2024-11-12
T00400,P0077,E00174,Wide method reason teach.,High,Open,2025-06-26
T00401,P0078,E00283,Investment both leave alone student trouble.,High,Blocked,2025-06-05
T00402,P0001,E00020,Eight anyone at son resource.,High,Completed,2025-08-23
T00403,P0149,E00488,Seat kid full could.,Low,In Progress,2024-11-01
T00404,P0160,E00276,Great kind behavior occur few carry simply.,High,Open,2025-07-24
T00405,P0011,E00392,Education court ground late in.,High,Completed,2025-04-22
T00406,P0118,E00183,Usually data alone hope she moment travel.,High,Open,2025-04-08
T00407,P0158,E00030,Actually everything night wait support difficult.,Low,Blocked,2024-12-14
T00408,P0121,E00317,Certainly follow democratic ability tell bank represent.,Low,In Progress,2025-09-06
T00409,P0143,E00338,Garden food policy size.,Medium,Open,2024-12-02
T00410,P0066,E00006,Work and yourself central meeting.,Low,Completed,2025-09-23
T00411,P0199,E00057,Total live measure he book simply.,Medium,In Progress,2025-09-16
T00412,P0115,E00054,Kitchen particular around protect.,High,Blocked,2025-08-09
T00413,P0076,E00444,Strategy work economy.,Low,Blocked,2025-09-26
T00414,P0136,E00208,Street possible ball administration seek care sit.,Low,Blocked,2025-02-24
T00415,P0168,E00037,Leader production spring group impact usually.,Medium,Blocked,2025-01-23
T00416,P0109,E00254,Hope scientist Democrat good continue.,High,Open,2025-02-06
T00417,P0017,E00390,Guess perform building ready grow instead then.,Medium,Open,2025-04-21
T00418,P0101,E00279,Painting address consumer.,High,In Progress,2025-09-01
T00419,P0166,E00498,Leg truth water increase plant state.,Medium,In Progress,2025-03-26
T00420,P0014,E00324,Summer hope such watch step population surface.,Low,Blocked,2025-05-29
T00421,P0151,E00199,Dream film need bring try eye PM.,Medium,Open,2025-01-20
T00422,P0200,E00354,Whose option not little go.,Low,Blocked,2025-07-01
T00423,P0013,E00441,What create table language.,Low,Open,2025-08-28
T00424,P0062,E00482,Upon hospital development explain word design someone.,Medium,Open,2025-01-10
T00425,P0152,E00045,Level decade Democrat agreement by win offer large.,Low,In Progress,2024-11-24
T00426,P0180,E00371,Recognize manager decision involve tough he theory plant.,High,Completed,2024-12-29
T00427,P0063,E00165,Where determine enter color.,High,Blocked,2025-03-15
T00428,P0194,E00105,Lay break year financial.,High,Completed,2025-05-30
T00429,P0182,E00272,Claim middle claim difference case miss series.,Medium,Blocked,2025-07-23
T00430,P0075,E00178,Reveal simple low clear lose any.,Medium,Open,2025-01-28
T00431,P0120,E00353,Part last generation adult art ok few.,High,Blocked,2025-05-15
T00432,P0056,E00109,Low deal base network.,Medium,Open,2024-12-19
T00433,P0079,E00015,Near local town success the.,High,Blocked,2024-12-01
T00434,P0030,E00406,Statement character artist walk.,Low,Blocked,2025-09-08
T00435,P0111,E00454,Start nature catch PM trial fund have.,Low,In Progress,2025-03-11
T00436,P0004,E00485,Mr close large finally impact suffer maintain.,Medium,Open,2025-06-10
T00437,P0107,E00359,Accept economic upon quality per camera theory camera.,High,Blocked,2024-10-08
T00438,P0019,E00383,Serious make part admit.,High,Open,2024-12-30
T00439,P0109,E00345,Ahead responsibility of film again.,High,Blocked,2025-03-18
T00440,P0192,E00141,Bad again red matter attention.,Medium,In Progress,2024-12-11
T00441,P0007,E00056,They role author Mrs home so.,Medium,In Progress,2025-01-17
T00442,P0167,E00083,Mother edge candidate reveal visit mission knowledge.,Low,In Progress,2024-10-08
T00443,P0194,E00275,Drop feeling ball quite.,Medium,Blocked,2025-03-11
T00444,P0101,E00454,Financial piece money speech.,High,Open,2025-01-12
T00445,P0172,E00464,Card level far eye business.,Low,Blocked,2025-06-28
T00446,P0102,E00396,Do reveal operation blue with stuff mind politics.,High,Open,2025-01-06
T00447,P0038,E00218,South born resource during question animal interview.,High,In Progress,2025-10-02
T00448,P0005,E00437,Many foreign American political television.,Low,Completed,2024-11-18
T00449,P0023,E00359,Cause American effect list.,High,Open,2025-07-26
T00450,P0158,E00412,Fight summer car operation standard send check woman.,Low,Open,2025-08-31
T00451,P0149,E00023,Professional hit ground daughter contain.,High,Blocked,2024-10-26
T00452,P0067,E00486,Election on statement black oil foreign.,High,In Progress,2025-03-15
T00453,P0078,E00199,It even help pattern second scientist me.,Low,Completed,2025-06-28
T00454,P0050,E00244,Difference project occur claim his six.,Low,Open,2025-05-05
T00455,P0171,E00139,Present stand thought as identify.,High,In Progress,2025-01-03
T00456,P0022,E00021,Case after matter cold will.,High,Open,2024-11-21
T00457,P0013,E00372,Bag news whole place machine.,Low,Completed,2025-03-18
T00458,P0065,E00452,Perhaps team or when.,High,Completed,2024-12-03
T00459,P0018,E00200,Around country drive never other car.,High,Blocked,2024-12-13
T00460,P0194,E00113,Among speech religious.,High,Blocked,2025-01-11
T00461,P0171,E00346,Talk letter somebody same form.,High,Completed,2025-05-14
T00462,P0192,E00151,Enter strategy account.,High,Completed,2025-04-11
T00463,P0018,E00027,Trouble soldier director.,High,Completed,2024-12-29
T00464,P0092,E00206,Business six anyone difference conference minute of.,Low,Open,2025-06-23
T00465,P0136,E00423,Kitchen high pressure especially apply.,High,Completed,2024-10-19
T00466,P0012,E00191,Hot modern dinner.,Medium,In Progress,2024-12-24
T00467,P0102,E00194,Someone trouble notice fast painting.,High,Blocked,2025-01-22
T00468,P0070,E00137,North theory tough they project.,Low,Completed,2025-06-05
T00469,P0111,E00239,International war billion story.,High,Blocked,2025-05-21
T00470,P0133,E00075,Young six happen east.,Low,Open,2025-09-08
T00471,P0043,E00391,Develop culture finally court.,High,Open,2025-09-01
T00472,P0138,E00362,Poor add response tree.,Low,Blocked,2025-08-12
T00473,P0098,E00336,Season training million high democratic.,Low,Completed,2025-07-19
T00474,P0032,E00299,Stay space street her computer.,Low,Blocked,2024-10-22
T00475,P0147,E00354,Mention nothing decide hit their million new.,High,Open,2025-01-04
T00476,P0094,E00032,Film light spring performance nation on situation.,Medium,Completed,2025-07-07
T00477,P0175,E00088,Program Mr job budget question car statement others.,High,Blocked,2025-03-23
T00478,P0088,E00158,Population maintain be about Republican whatever state.,High,Blocked,2025-03-24
T00479,P0014,E00359,Establish least space.,Low,In Progress,2025-10-04
T00480,P0115,E00380,Congress practice grow bag wonder mind.,Medium,In Progress,2024-10-18
T00481,P0167,E00382,Early suffer maybe tree.,Medium,Open,2024-11-22
T00482,P0046,E00050,Even store big leg.,Low,Blocked,2024-11-06
T00483,P0171,E00241,Source attention try will federal.,High,Completed,2025-01-21
T00484,P0158,E00443,Part describe happen sit participant find.,High,Open,2025-05-04
T00485,P0118,E00154,Easy focus consumer painting your.,Low,In Progress,2025-01-16
T00486,P0083,E00452,Involve owner throughout bag.,Low,In Progress,2025-02-11
T00487,P0034,E00178,Drive identify TV some peace investment.,Medium,Blocked,2024-12-07
T00488,P0056,E00215,Job property general degree pressure level.,Low,In Progress,2025-06-12
T00489,P0093,E00325,Recent order factor.,High,Completed,2025-04-09
T00490,P0118,E00409,Miss quite true born development pay note.,Medium,Completed,2025-07-31
T00491,P0026,E00023,Figure crime lawyer city.,Medium,Open,2025-04-30
T00492,P0096,E00036,Order exist together hotel notice know impact.,Medium,Blocked,2025-06-30
T00493,P0070,E00331,Professional price party street yard billion.,High,In Progress,2025-05-14
T00494,P0049,E00431,Discussion activity official admit suggest attention pressure day.,Low,Completed,2025-08-23
T00495,P0028,E00157,Not lose plant fire color.,Low,Completed,2025-08-12
T00496,P0199,E00336,Scene point buy whole wonder opportunity western.,Low,In Progress,2024-10-14
T00497,P0029,E00170,Same the figure around describe time.,High,Open,2025-09-23
T00498,P0147,E00109,Cause report travel bill again dark.,Medium,In Progress,2024-12-13
T00499,P0099,E00467,Few economic staff opportunity suddenly.,Low,Open,2024-10-11
T00500,P0029,E00183,Until artist happy tough your example kitchen.,Low,Blocked,2025-06-28
T00501,P0126,E00297,Well agency need north.,Low,Completed,2024-12-25
T00502,P0084,E00128,Foot television left difficult see prevent.,Low,Open,2024-10-12
T00503,P0048,E00310,For fight poor number.,Low,Completed,2025-08-26
T00504,P0130,E00010,Long prepare occur store throughout so station.,High,Open,2025-03-17
T00505,P0071,E00068,Course I couple coach him keep.,Low,Completed,2024-10-24
T00506,P0128,E00168,Mouth ten pretty man involve must item.,Low,Open,2025-01-19
T00507,P0147,E00327,Social charge sea available food wish.,Low,In Progress,2024-12-16
T00508,P0144,E00162,Consider activity leave relate whole.,Medium,Completed,2024-10-25
T00509,P0021,E00081,Such officer happen image chance ever blue.,Medium,In Progress,2025-08-24
T00510,P0145,E00098,Trip hundred same treatment.,High,Completed,2024-11-10
T00511,P0136,E00109,Goal onto significant statement.,High,Open,2024-12-29
T00512,P0120,E00071,People another law piece expect deep.,Low,Blocked,2024-12-20
T00513,P0162,E00492,Partner economic huge grow face him hour.,High,In Progress,2025-04-17
T00514,P0064,E00158,Safe food dream rise.,High,Blocked,2025-07-19
T00515,P0053,E00077,Employee value rich begin arm behind story.,Medium,Open,2024-12-21
T00516,P0006,E00254,Skin less statement worker major.,Low,In Progress,2025-02-16
T00517,P0024,E00418,Provide show item activity two.,Medium,Blocked,2025-03-11
T00518,P0085,E00082,Game subject manager third outside blood.,Low,Open,2025-07-26
T00519,P0107,E00392,Do question spring.,Low,Blocked,2025-02-03
T00520,P0059,E00039,Lot cup mission home relationship available maybe.,Low,Open,2025-08-11
T00521,P0153,E00412,Throughout third if ability ever camera history.,Medium,Open,2025-09-16
T00522,P0073,E00146,Old no who quality power respond huge good.,Low,In Progress,2024-10-20
T00523,P0089,E00237,System half girl animal fish half policy consumer.,Medium,Completed,2025-06-03
T00524,P0037,E00498,Worry role or I might person wife.,High,Open,2025-07-18
T00525,P0196,E00273,How mean politics pick board.,Low,In Progress,2025-06-10
T00526,P0064,E00413,Itself military computer husband method name.,Medium,In Progress,2025-05-02
T00527,P0187,E00387,Apply though firm game just.,Low,Blocked,2024-12-27
T00528,P0089,E00443,Almost discover energy language collection it.,Low,In Progress,2024-12-02
T00529,P0132,E00254,Store central your seem letter.,Low,Completed,2025-01-09
T00530,P0046,E00190,Big visit near without law first.,Medium,Completed,2024-12-14
T00531,P0184,E00450,Her pay receive brother culture just second every.,Low,Completed,2025-03-15
T00532,P0067,E00197,Top partner tonight professor affect.,Low,In Progress,2025-06-02
T00533,P0016,E00469,Should give large usually view.,Low,Completed,2025-05-07
T00534,P0062,E00343,Memory system perhaps hear.,High,Blocked,2025-03-22
T00535,P0005,E00022,Certainly great recently cup create.,High,Completed,2025-03-05
T00536,P0136,E00042,Wonder front once really thank response benefit.,Low,In Progress,2025-01-24
T00537,P0190,E00303,Republican dream do weight method north together inside.,Medium,Open,2024-11-12
T00538,P0066,E00273,Sit class raise article such.,Medium,Blocked,2025-02-19
T00539,P0100,E00465,Happy election difficult line standard of hope place.,High,Completed,2025-05-21
T00540,P0121,E00434,Image design night Republican.,High,Completed,2025-09-07
T00541,P0118,E00220,Century base break discussion be interest cold.,Low,Open,2025-08-03
T00542,P0059,E00495,Center nice toward owner fact.,Low,Open,2024-11-22
T00543,P0047,E00329,Particularly order may by specific head matter detail.,Low,In Progress,2024-12-02
T00544,P0134,E00306,Story key so see themselves.,High,Blocked,2025-06-11
T00545,P0137,E00269,Street certain gas throughout or impact.,Medium,In Progress,2025-03-12
T00546,P0017,E00142,Age in add else here.,High,Open,2025-04-25
T00547,P0035,E00066,Land rest much every brother something something old.,High,In Progress,2025-01-12
T00548,P0020,E00232,Trouble try if learn.,Medium,Open,2025-05-22
T00549,P0065,E00045,Almost nature make shake set any approach agreement.,High,Completed,2025-05-14
T00550,P0142,E00270,Drug full goal fall grow.,Low,Blocked,2025-03-02
T00551,P0187,E00153,Mouth require how decade some.,Medium,Blocked,2025-09-16
T00552,P0102,E00488,Short build west others collection speech.,High,Open,2025-02-12
T00553,P0081,E00181,Around paper chance oil opportunity.,Low,Blocked,2025-08-10
T00554,P0165,E00305,Benefit exactly hit situation point.,Low,Open,2025-02-21
T00555,P0200,E00431,Window risk very movement.,High,Completed,2025-09-14
T00556,P0020,E00051,Peace fall card guy yourself.,High,Open,2024-11-23
T00557,P0196,E00352,Message west professional however good learn consider.,Medium,Blocked,2025-07-14
T00558,P0092,E00212,Information end policy just hear.,High,Completed,2025-02-01
T00559,P0009,E00216,Home store movie of study peace.,Medium,Blocked,2025-07-20
T00560,P0170,E00160,Surface myself argue remember.,Medium,Completed,2024-11-20
T00561,P0089,E00318,Measure contain bad.,Low,Completed,2025-06-01
T00562,P0159,E00069,Business herself happen station through base player.,Low,Open,2024-11-30
T00563,P0191,E00138,Able kind end play go blood real.,Medium,In Progress,2024-11-19
T00564,P0175,E00476,Visit daughter drug.,Medium,In Progress,2024-11-27
T00565,P0094,E00097,Or prevent several almost say responsibility.,High,Blocked,2025-02-20
T00566,P0019,E00069,Statement view adult sort away.,Low,In Progress,2025-04-15
T00567,P0193,E00474,Level nearly PM instead wish tell.,Medium,Open,2025-09-25
T00568,P0029,E00347,Candidate option community party best.,Low,In Progress,2025-01-03
T00569,P0109,E00269,Identify street offer perform central red.,High,Open,2025-07-17
T00570,P0027,E00490,Side wind air least.,High,Open,2025-09-23
T00571,P0064,E00266,Control describe anything middle.,Medium,In Progress,2024-10-09
T00572,P0148,E00400,Window produce same window animal.,Medium,Blocked,2025-09-06
T00573,P0004,E00333,These lay although movie key power brother model.,Medium,Completed,2024-10-14
T00574,P0086,E00011,Coach best miss until.,High,Blocked,2025-06-17
T00575,P0027,E00386,Discover likely be culture ball.,Low,Blocked,2025-02-16
T00576,P0042,E00321,Various machine appear our.,High,Open,2024-12-16
T00577,P0089,E00374,War season business need item.,Medium,Open,2025-02-26
T00578,P0021,E00231,Matter seem individual.,Low,Blocked,2025-01-09
T00579,P0043,E00495,Artist design throw future particularly big.,High,Completed,2025-01-09
T00580,P0021,E00265,Inside billion across example eight law.,Medium,In Progress,2024-11-14
T00581,P0031,E00198,Dinner just step low.,Low,Completed,2025-03-25
T00582,P0007,E00183,Analysis peace if year option east cause.,Low,Completed,2024-10-07
T00583,P0021,E00094,Indicate smile computer street project.,Low,Open,2025-01-13
T00584,P0188,E00052,Finally rise strategy lead forget deep smile.,High,Open,2025-03-13
T00585,P0053,E00239,System language win she for worry movie remain.,Low,In Progress,2025-02-13
T00586,P0029,E00392,Plan each range fast interview.,Medium,In Progress,2025-02-02
T00587,P0065,E00094,Expert add space author scientist discover later human.,Low,Completed,2025-07-12
T00588,P0004,E00355,Size administration draw green box sometimes world.,Low,In Progress,2025-05-08
T00589,P0117,E00200,Attention moment like into show talk Mr fall.,Low,Blocked,2024-10-08
T00590,P0079,E00008,Speech middle practice begin.,Medium,Blocked,2025-02-07
T00591,P0173,E00159,Action and American can economy.,Medium,Blocked,2024-11-06
T00592,P0183,E00213,After knowledge space election budget.,High,In Progress,2024-10-31
T00593,P0141,E00051,Decade prepare or meet.,Medium,In Progress,2025-04-24
T00594,P0012,E00228,Door people center argue.,Medium,In Progress,2024-10-27
T00595,P0078,E00280,Must hotel should sit animal.,Low,Open,2024-11-22
T00596,P0049,E00104,Catch like age son season card amount.,Low,Open,2025-01-24
T00597,P0059,E00365,Anything study just letter while line.,Medium,In Progress,2025-04-11
T00598,P0154,E00098,Yard get pick instead machine once win.,Medium,Open,2025-09-04
T00599,P0077,E00178,Material people go hard defense interview.,High,Blocked,2025-01-05
T00600,P0026,E00158,Quite time she begin experience.,Medium,Open,2025-08-28
T00601,P0188,E00347,Successful me about size magazine decision.,Medium,Open,2025-02-17
T00602,P0003,E00332,Certainly opportunity PM.,Medium,Blocked,2024-10-05
T00603,P0190,E00346,Media work deal dark step.,High,Completed,2024-10-18
T00604,P0069,E00315,Officer prepare surface herself ability.,High,Blocked,2025-07-31
T00605,P0096,E00120,Pressure person accept agency.,High,In Progress,2025-05-17
T00606,P0191,E00247,Expert risk experience you suddenly face another.,Low,Completed,2025-08-25
T00607,P0068,E00307,Play effort today professional night.,High,Blocked,2025-03-19
T00608,P0003,E00338,Yourself should necessary pass hour people.,High,Blocked,2025-01-08
T00609,P0013,E00074,Have wrong avoid war together number teacher.,Medium,Open,2025-04-08
T00610,P0155,E00264,Rock class decade detail require amount leg.,Medium,In Progress,2025-08-02
T00611,P0144,E00291,Leave hear she size market move.,Medium,Completed,2024-12-05
T00612,P0057,E00342,Season case see.,High,Completed,2025-04-14
T00613,P0005,E00034,Security theory course low.,Medium,In Progress,2025-06-08
T00614,P0173,E00054,Medical evening standard fact person.,Low,Open,2025-07-11
T00615,P0166,E00386,Clearly first light animal color.,Medium,Open,2025-08-11
T00616,P0008,E00091,Record project think our.,Low,Open,2025-07-13
T00617,P0088,E00004,Economic great girl.,Medium,Blocked,2025-01-15
T00618,P0118,E00010,Left drive born rise.,Low,Blocked,2025-08-21
T00619,P0039,E00366,Score least professor decade without.,High,In Progress,2025-08-24
T00620,P0168,E00070,Window as director visit social catch community.,Low,Completed,2025-01-17
T00621,P0145,E00369,Place task still many southern question member.,Low,In Progress,2025-10-02
T00622,P0130,E00287,Task that the whose and.,Low,Open,2025-09-05
T00623,P0061,E00158,Marriage ask allow read range president important.,Medium,Completed,2024-10-09
T00624,P0175,E00129,Miss reach half away eight leader.,Low,Open,2025-08-18
T00625,P0020,E00122,Economy environment ball let western anything.,High,Open,2025-05-04
T00626,P0062,E00251,Soon situation worker.,Medium,Blocked,2024-10-15
T00627,P0075,E00177,Forget believe we pattern.,High,Completed,2024-11-13
T00628,P0009,E00479,Edge start share.,Low,Blocked,2025-06-02
T00629,P0016,E00368,Leg act debate price without meeting.,Low,Blocked,2025-08-16
T00630,P0174,E00093,Item part magazine my pull.,Low,In Progress,2025-01-20
T00631,P0064,E00309,Whom wear education tax talk.,High,Completed,2025-04-27
T00632,P0123,E00220,Answer indeed share wife all when.,Low,Open,2025-07-31
T00633,P0198,E00460,Anyone make international TV mouth model artist these.,Medium,Blocked,2025-06-19
