task_id,project_id,assignee_id,description,priority,status,due_date
T00634,P0091,E00145,Culture lot lot great event discover.,Low,In Progress,2024-11-06
T00635,P0111,E00243,Record price to sister above staff three.,Medium,In Progress,2024-12-30
T00636,P0045,E00326,Medical six people rich show stage.,High,Open,2025-02-23
T00637,P0146,E00037,Whatever cold audience detail might.,Medium,Open,2025-06-28
T00638,P0107,E00401,Energy debate senior course simple.,Low,Completed,2025-09-17
T00639,P0081,E00447,Happy away design front else leader any.,High,In Progress,2025-05-27
T00640,P0135,E00036,Body beat tell organization chance world.,High,Completed,2025-06-05
T00641,P0042,E00084,Over impact color media represent mind.,Medium,Blocked,2025-03-07
T00642,P0038,E00329,Pm meet seem north trip.,Medium,Open,2025-01-03
T00643,P0060,E00335,Site understand important there pattern.,Medium,Open,2024-11-25
T00644,P0186,E00470,Herself light then small control quite.,High,In Progress,2025-04-29
T00645,P0033,E00315,Pressure Democrat in theory per fly fly.,Low,Completed,2025-08-17
T00646,P0167,E00233,Response chair north yeah gun hour common.,Low,Blocked,2025-01-04
T00647,P0095,E00354,Protect goal may center her idea present.,High,In Progress,2025-08-22
T00648,P0104,E00260,School news church because industry author.,Low,In Progress,2025-07-27
T00649,P0113,E00378,Of let minute.,Low,Blocked,2025-03-30
T00650,P0028,E00042,Now accept live.,Medium,Blocked,2025-08-21
T00651,P0108,E00132,Will anything year around.,High,Blocked,2025-07-05
T00652,P0048,E00448,Sound then effort me.,Medium,Blocked,2024-12-11
T00653,P0035,E00066,Final leader budget yeah kitchen indeed not.,Low,Blocked,2025-03-12
T00654,P0076,E00418,Find goal sound.,Low,In Progress,2024-12-16
T00655,P0134,E00438,Change ago know risk leave.,High,In Progress,2025-07-09
T00656,P0055,E00496,Others laugh soldier fish.,High,Blocked,2025-02-28
T00657,P0133,E00203,Record alone focus key.,High,Open,2025-08-30
T00658,P0192,E00286,Out relate owner three not thousand tough.,Low,Completed,2024-11-08
T00659,P0139,E00184,Year catch worry push.,Medium,In Progress,2024-11-01
T00660,P0099,E00041,Dinner hospital this.,Medium,In Progress,2024-12-08
T00661,P0024,E00496,Reflect class western again almost wall.,Low,Blocked,2025-04-13
T00662,P0169,E00309,While building the ten meet Mrs.,Low,Open,2025-03-21
T00663,P0081,E00309,Success fight beat forward human authority hair.,Low,Blocked,2025-06-16
T00664,P0140,E00062,General spend customer without marriage turn.,Medium,Completed,2025-04-10
T00665,P0044,E00161,Parent year wait usually go reach.,High,Blocked,2024-10-04
T00666,P0016,E00083,Successful them range or.,Low,In Progress,2024-10-25
T00667,P0139,E00211,Account cause experience question yourself week paper.,High,Completed,2025-09-14
T00668,P0190,E00114,View since their painting.,Low,Blocked,2024-10-05
T00669,P0157,E00091,Job hand manager really physical better live.,High,Completed,2025-08-28
T00670,P0089,E00031,Staff free fear answer.,Medium,Open,2025-08-30
T00671,P0067,E00451,Market late professional plan name increase visit occur.,Low,Blocked,2024-12-15
T00672,P0134,E00442,Community less reality prevent possible.,Low,In Progress,2025-04-20
T00673,P0146,E00133,Part teach paper test.,Low,Open,2024-12-09
T00674,P0112,E00154,Country to plan hotel place right property everything.,High,In Progress,2025-08-16
T00675,P0004,E00003,Himself pass page lawyer behind table certain.,Medium,In Progress,2025-03-26
T00676,P0166,E00140,Door push everyone.,High,In Progress,2025-06-01
T00677,P0193,E00305,Mind hundred claim watch concern.,Medium,Blocked,2025-08-25
T00678,P0077,E00394,Must lot big give almost.,Low,Open,2025-02-08
T00679,P0037,E00188,Politics nation than drive lead Mrs.,High,Completed,2025-02-21
T00680,P0133,E00326,Summer worker test language order minute billion vote.,Low,Open,2025-02-27
T00681,P0018,E00240,Environment reality forget board mean same party.,Low,Open,2024-11-18
T00682,P0073,E00224,Remember hotel really authority organization high big tree.,High,Blocked,2025-04-10
T00683,P0109,E00286,Reflect white hard moment artist number leg.,High,Open,2024-11-11
T00684,P0151,E00193,Would century oil.,Medium,Completed,2025-03-03
T00685,P0074,E00389,Argue key feel kind.,Medium,Open,2025-02-02
T00686,P0005,E00020,Number stop receive.,Low,Blocked,2025-02-19
T00687,P0065,E00352,Bit first hospital sit agency.,High,In Progress,2025-05-23
T00688,P0009,E00491,Employee since prepare region mind seven technology.,Low,Blocked,2025-05-21
T00689,P0051,E00050,Color somebody admit have now American event able.,Medium,Open,2025-05-01
T00690,P0183,E00495,City quickly election claim involve world performance.,Medium,In Progress,2025-05-27
T00691,P0114,E00283,Left young instead none.,Low,Blocked,2025-07-08
T00692,P0014,E00374,Ago suddenly detail answer stand.,Medium,In Progress,2025-09-18
T00693,P0069,E00143,Painting food thus agree friend mother suddenly.,High,In Progress,2024-10-21
T00694,P0168,E00335,Answer century start decade cup remain.,High,Open,2025-08-11
T00695,P0124,E00368,Relate support word production country skill.,Low,In Progress,2025-07-28
T00696,P0016,E00339,Guy degree natural ago everyone.,Low,Completed,2024-12-23
T00697,P0096,E00075,Out control performance project mother point pressure.,Medium,Completed,2025-02-15
T00698,P0021,E00068,Republican expert analysis writer list write someone.,Medium,Completed,2025-05-06
T00699,P0012,E00025,Night better evening capital cut door age parent.,Medium,Open,2025-09-12
T00700,P0189,E00263,Cold south start television while scene.,Medium,In Progress,2025-08-18
T00701,P0008,E00126,Movement bag cause themselves computer performance.,Medium,Completed,2025-08-03
T00702,P0052,E00494,Design identify degree drop here treatment.,High,Open,2025-03-10
T00703,P0092,E00206,None turn wife.,High,In Progress,2025-06-28
T00704,P0177,E00465,Hand somebody more as although.,Low,In Progress,2025-08-31
T00705,P0137,E00385,Image what culture agree stage.,Low,Completed,2024-12-11
T00706,P0197,E00018,How leg risk blue later several.,Medium,Blocked,2024-12-01
T00707,P0149,E00346,You magazine edge us old.,High,Blocked,2024-12-12
T00708,P0113,E00447,Enjoy other fall dog position choice.,Medium,Open,2025-05-07
T00709,P0090,E00354,Stock challenge customer sign citizen outside.,Medium,Completed,2025-04-15
T00710,P0189,E00290,Whole use drug fly customer give house cause.,High,Blocked,2024-10-31
T00711,P0023,E00464,Week use trade shoulder song.,High,Open,2025-05-06
T00712,P0113,E00472,Expect play between computer eye help brother.,High,Completed,2024-11-13
T00713,P0006,E00199,Individual blue artist way property nothing.,Medium,In Progress,2025-03-02
T00714,P0040,E00399,Act likely sister success president good any probably.,Medium,Open,2025-01-04
T00715,P0005,E00424,Lose become Congress tax himself.,Medium,In Progress,2025-01-28
T00716,P0074,E00096,Technology entire let dog general important.,Medium,Open,2025-08-27
T00717,P0090,E00286,Word determine listen view suffer red discussion.,High,Completed,2024-10-28
T00718,P0088,E00402,Forward face better writer everybody.,High,Open,2025-01-12
T00719,P0013,E00440,Image especially operation able.,Low,Open,2025-04-14
T00720,P0108,E00382,Anyone edge analysis message else seven.,Medium,Blocked,2024-12-27
T00721,P0025,E00324,Game development conference yourself certain true involve.,Medium,Open,2025-05-20
T00722,P0122,E00293,Well college film situation central general program.,Medium,Open,2025-01-17
T00723,P0062,E00488,Cold agency hotel nor different similar.,High,In Progress,2025-02-03
T00724,P0121,E00033,Fine life girl team area final Mr.,Low,Completed,2025-01-02
T00725,P0112,E00239,We small whom everybody growth get particular.,Medium,Blocked,2025-04-18
T00726,P0055,E00027,Husband later each foot own region officer.,Low,Blocked,2024-12-06
T00727,P0135,E00113,Assume economic eat own soon beyond.,Medium,Blocked,2024-12-10
T00728,P0178,E00421,Teach main senior raise.,High,Completed,2024-11-01
T00729,P0095,E00072,Season know eye recent.,Medium,In Progress,2024-12-07
T00730,P0039,E00222,Simply early summer point particular movie institution.,Low,Blocked,2025-04-11
T00731,P0058,E00127,Board particular bill.,Medium,Blocked,2025-03-05
T00732,P0101,E00223,Beat partner relationship down project grow.,Medium,Completed,2025-07-26
T00733,P0088,E00380,Firm power garden send while sell.,High,Completed,2024-11-09
T00734,P0117,E00475,And message star fly follow father another describe.,Low,Blocked,2024-11-27
T00735,P0176,E00093,Spring finally inside partner sure life.,Medium,Blocked,2025-04-14
T00736,P0142,E00062,Technology improve news paper inside out.,Low,Blocked,2024-10-10
T00737,P0034,E00089,Candidate become anyone little can field themselves.,Low,Open,2025-09-24
T00738,P0091,E00402,Yard sound raise.,Medium,In Progress,2025-09-23
T00739,P0186,E00046,Go try maybe program step pick middle.,Low,Completed,2024-10-22
T00740,P0170,E00199,Big nearly situation school.,Low,In Progress,2024-10-16
T00741,P0139,E00050,Card price indeed game information point performance.,High,Open,2025-07-17
T00742,P0089,E00494,Ahead stock loss always discussion control.,Medium,Completed,2025-01-08
T00743,P0190,E00414,Computer eye girl American if.,Low,Completed,2025-04-15
T00744,P0010,E00100,Rate guy campaign near speech surface high.,High,In Progress,2025-08-03
T00745,P0050,E00059,Direction represent course put.,High,Blocked,2025-06-25
T00746,P0073,E00418,Whose since draw gas hundred heavy.,High,Blocked,2024-10-30
T00747,P0094,E00321,Describe nothing tree.,Low,Blocked,2025-09-25
T00748,P0107,E00292,Artist themselves half forward.,Medium,In Progress,2025-01-22
T00749,P0195,E00449,Live month husband cold city study.,Medium,Open,2024-12-22
T00750,P0031,E00073,Political spring dinner and agent.,Low,In Progress,2025-05-11
T00751,P0088,E00178,Instead debate example country themselves.,Low,In Progress,2024-10-15
T00752,P0060,E00140,Far exactly west.,Low,Open,2025-01-16
T00753,P0198,E00043,Teacher bit color seek.,Low,Open,2025-09-30
T00754,P0141,E00295,Resource ground each notice.,Low,Blocked,2025-01-12
T00755,P0073,E00140,Remember simple police class just.,High,Completed,2024-12-10
T00756,P0150,E00175,List current race let chance off modern.,Medium,Completed,2025-07-22
T00757,P0194,E00500,Customer become blue foreign western practice five ten.,Medium,Completed,2025-09-13
T00758,P0169,E00074,Husband he this.,Medium,Completed,2025-06-11
T00759,P0007,E00297,Son newspaper above loss.,High,Open,2025-07-04
T00760,P0023,E00467,Government too else air.,Medium,Open,2025-03-19
T00761,P0033,E00282,Today able I camera mention support.,High,Completed,2025-01-12
T00762,P0105,E00036,Pattern bed evidence protect Republican.,High,Open,2025-10-01
T00763,P0141,E00293,Candidate energy resource could policy hundred baby.,Low,Open,2024-11-20
T00764,P0035,E00151,Improve eat cause democratic approach.,High,Blocked,2025-03-20
T00765,P0122,E00403,Base study build plan.,Medium,Blocked,2025-03-18
T00766,P0171,E00292,Appear according eye early nation.,High,In Progress,2025-01-21
T00767,P0065,E00156,How drive yeah wind.,High,Completed,2025-07-21
T00768,P0167,E00190,Yeah long group car ground coach produce available.,High,Blocked,2025-02-25
T00769,P0061,E00067,Kitchen report notice our network individual.,Low,Completed,2025-02-25
T00770,P0144,E00077,Owner mean out article.,Low,Open,2025-04-14
T00771,P0080,E00289,Worry collection focus decide important.,High,In Progress,2025-03-12
T00772,P0028,E00497,Government wind economy speak force seven.,Medium,Completed,2024-10-24
T00773,P0157,E00034,Pay nearly crime cause.,High,Blocked,2024-11-14
T00774,P0091,E00465,Page everyone six eat window line structure.,Low,Completed,2025-07-24
T00775,P0134,E00047,One onto lawyer sure professional perhaps son.,Medium,In Progress,2025-02-21
T00776,P0040,E00025,Man analysis world structure sign economy allow clear.,Medium,Blocked,2025-03-29
T00777,P0036,E00223,Too expect play Mr particularly.,Low,Open,2024-12-20
T00778,P0157,E00466,Sure condition simple myself short.,Low,Open,2024-12-21
T00779,P0093,E00054,Office much assume training model network.,Low,In Progress,2025-02-13
T00780,P0177,E00106,Technology example age major throughout.,Medium,Blocked,2025-02-18
T00781,P0150,E00406,Instead choice raise first.,Low,Open,2025-06-26
T00782,P0162,E00457,Beyond put that while similar trip major between.,Medium,Blocked,2025-05-06
T00783,P0107,E00301,Manager simple four attention cold relationship.,Medium,Blocked,2025-06-03
T00784,P0114,E00232,Note budget while write purpose risk.,Low,Open,2025-05-06
T00785,P0192,E00354,Evening share information only hotel federal administration population.,Low,In Progress,2025-04-24
T00786,P0180,E00127,Remember short behavior behind nearly.,Low,Open,2024-10-13
T00787,P0192,E00274,Spend market operation few civil morning.,Low,Open,2025-03-07
T00788,P0146,E00375,Eight message myself long but when per.,High,Open,2025-04-19
T00789,P0146,E00021,Success boy environmental likely stage son such.,Medium,Blocked,2025-09-15
T00790,P0158,E00456,Respond available toward though.,Low,Open,2024-10-17
T00791,P0020,E00337,Think near her.,High,Open,2025-01-07
T00792,P0026,E00269,Edge account may pass space than citizen analysis.,Low,In Progress,2024-12-10
T00793,P0112,E00239,Nearly begin choice especially.,Low,Blocked,2025-03-06
T00794,P0155,E00197,Factor under reason government agent.,High,Completed,2025-04-13
T00795,P0195,E00124,New but age administration.,Low,Blocked,2025-03-03
T00796,P0106,E00166,History art ask form two agreement special.,Medium,Completed,2024-10-29
T00797,P0169,E00416,Return apply drop market quite according so.,Medium,Open,2024-11-21
T00798,P0168,E00383,Play somebody employee several.,High,Blocked,2025-10-03
T00799,P0028,E00068,Allow down strategy inside hour exactly.,Medium,Completed,2025-10-03
T00800,P0051,E00230,Herself old dog clearly race line.,High,Blocked,2025-03-24
T00801,P0083,E00083,Part number choose work.,High,In Progress,2025-02-14
T00802,P0057,E00346,Career quickly wonder race phone during oil me.,High,In Progress,2025-08-26
T00803,P0084,E00085,Middle claim beyond mind.,Medium,In Progress,2025-01-04
T00804,P0081,E00183,Agent ready among industry cold.,Low,Completed,2024-12-15
T00805,P0077,E00447,Theory story town cost upon role everybody training.,Low,Completed,2025-07-11
T00806,P0018,E00234,Standard near west job during.,Medium,Open,2025-08-26
T00807,P0170,E00268,Life order another inside mention base Republican.,High,Open,2025-03-01
T00808,P0055,E00149,Other what song feeling.,High,Open,2025-02-02
T00809,P0141,E00463,Thus process seven check.,Medium,In Progress,2024-12-03
T00810,P0129,E00161,Seek box score level national concern.,Medium,Completed,2025-06-29
T00811,P0196,E00102,General question early while.,Low,In Progress,2025-04-25
T00812,P0160,E00192,Trip director try budget recognize theory way really.,Low,Blocked,2025-02-10
T00813,P0043,E00420,Write choice top out appear arrive court.,Low,Completed,2025-08-27
T00814,P0141,E00117,Sport fall every response represent likely.,High,Blocked,2025-08-12
T00815,P0178,E00329,Option song by agreement provide.,Medium,In Progress,2025-05-30
T00816,P0170,E00344,Down top listen learn yeah two.,Medium,Blocked,2024-11-02
T00817,P0004,E00031,Mission information from add.,Low,In Progress,2025-09-03
T00818,P0007,E00478,Rate speech that policy teach listen.,Low,Blocked,2025-07-01
T00819,P0163,E00413,View decide two note put.,Low,Blocked,2025-07-17
T00820,P0147,E00004,Bag Mrs task open career show why.,High,Blocked,2024-10-26
T00821,P0152,E00105,Arm he get their ready else wife.,Medium,Open,2025-05-02
T00822,P0153,E00044,Wide help century should glass far course.,Low,Open,2025-03-14
T00823,P0042,E00168,Impact apply focus court rest kind often.,Low,In Progress,2025-09-29
T00824,P0028,E00258,Reality catch store let so.,Low,Completed,2024-11-01
T00825,P0089,E00276,Near stuff leader option assume official director.,Medium,In Progress,2024-11-23
T00826,P0136,E00369,Trip painting protect dream simple.,Medium,Blocked,2025-08-14
T00827,P0037,E00003,Ground concern middle relate.,High,Blocked,2025-09-09
T00828,P0174,E00112,City us political government.,Low,Blocked,2025-04-23
T00829,P0026,E00008,East answer market discuss.,High,Blocked,2025-08-21
T00830,P0045,E00123,Black outside whose fish.,Medium,Completed,2025-01-31
T00831,P0075,E00286,Room conference suggest lawyer future lay road.,Medium,Open,2025-02-16
T00832,P0031,E00256,Surface actually mind pressure.,Medium,In Progress,2025-04-23
T00833,P0187,E00052,Board later remain appear individual blue.,High,Completed,2025-03-23
T00834,P0192,E00021,Let article first.,Medium,Open,2025-04-30
T00835,P0111,E00013,Financial down ago force course day.,Medium,Blocked,2025-03-31
T00836,P0092,E00153,With court store.,Medium,Open,2024-11-26
T00837,P0076,E00274,Pretty material use unit cost recent.,Medium,Blocked,2025-02-25
T00838,P0014,E00386,Nearly per chair effect.,Low,Completed,2025-05-13
T00839,P0135,E00036,Visit health campaign purpose design factor.,Medium,In Progress,2025-02-22
T00840,P0051,E00149,Wait leg skin color.,High,In Progress,2025-09-02
T00841,P0169,E00272,Rich improve everything black.,Low,In Progress,2025-07-17
T00842,P0077,E00094,Through see same answer without side question.,High,Blocked,2025-09-29
T00843,P0094,E00151,Arm choose produce amount may.,Medium,Open,2024-12-29
T00844,P0092,E00007,Meeting exactly decision behind.,High,In Progress,2025-05-17
T00845,P0198,E00247,Lawyer shoulder practice.,Medium,Open,2025-02-25
T00846,P0190,E00473,Trouble peace news western above indeed action.,Medium,In Progress,2025-05-26
T00847,P0102,E00097,Student ever either office.,High,Blocked,2025-04-23
T00848,P0127,E00296,Pay various part occur former throw.,Medium,Blocked,2025-02-18
T00849,P0114,E00205,Father forward forget serious describe.,Low,In Progress,2025-01-12
T00850,P0127,E00094,End issue magazine move street catch.,High,Completed,2025-10-04
T00851,P0047,E00117,Eye large debate state list.,Medium,In Progress,2025-04-10
T00852,P0106,E00247,Many because ready people today we.,High,Open,2025-04-02
T00853,P0006,E00076,Peace learn through seven alone actually safe.,Low,In Progress,2025-06-18
T00854,P0192,E00110,Reveal line investment.,Low,Open,2025-01-06
T00855,P0051,E00104,Eye take our popular travel democratic employee.,Low,Blocked,2025-04-30
T00856,P0077,E00231,Agent worker series position tax apply.,High,Completed,2025-09-03
T00857,P0104,E00132,Year many democratic career especially mother.,Medium,Blocked,2024-11-01
T00858,P0107,E00058,Middle late common cultural chair necessary avoid.,High,Blocked,2025-10-01
T00859,P0165,E00323,The quite much hospital.,Medium,Blocked,2024-10-24
T00860,P0012,E00095,Suggest citizen choice clearly Mrs center world.,Low,Open,2025-03-20
T00861,P0042,E00397,Show environment reduce.,High,Open,2025-04-24
T00862,P0186,E00236,Key city go old entire.,Low,Completed,2025-03-28
T00863,P0133,E00290,Them night remain the particularly outside.,Medium,Blocked,2025-07-21
T00864,P0155,E00196,Toward experience sign measure stock who.,High,Blocked,2024-12-06
T00865,P0058,E00110,Role smile again movement phone join rather.,High,Open,2025-07-31
T00866,P0110,E00326,Grow gas behind fish bed responsibility sometimes report.,Medium,Completed,2025-08-24
T00867,P0153,E00106,Financial place this window machine.,High,In Progress,2024-11-23
T00868,P0124,E00041,Suddenly field traditional success not coach data.,Low,Open,2025-03-31
T00869,P0132,E00248,Name describe travel art.,Medium,Open,2025-06-22
T00870,P0078,E00061,American course change claim myself bit.,Low,Open,2024-10-26
T00871,P0066,E00016,Discuss military involve term.,High,Blocked,2025-03-29
T00872,P0187,E00005,News side water front issue.,Low,In Progress,2025-01-24
T00873,P0037,E00477,Against grow those need upon bank parent stage.,Low,Completed,2025-04-18
T00874,P0083,E00496,Sea note mouth hear wish along plant edge.,Medium,In Progress,2025-07-28
T00875,P0090,E00439,Mission expert produce just already decide.,High,Open,2025-08-14
T00876,P0049,E00067,Education able hundred kitchen send young region.,Medium,Completed,2024-10-20
T00877,P0138,E00128,Religious car teacher each.,Medium,Open,2025-05-16
T00878,P0147,E00100,Network either wall attorney collection pattern.,High,Open,2025-07-23
T00879,P0052,E00363,Including chair author great so computer.,Low,Blocked,2025-02-24
T00880,P0112,E00327,Attorney agreement staff find six tough public.,High,Completed,2025-06-03
T00881,P0128,E00148,Church college gas truth Democrat.,High,In Progress,2025-09-11
T00882,P0068,E00122,Ability Mrs thus agent mission feel enter wish.,High,Completed,2025-05-22
T00883,P0014,E00455,Stand sit hot soon long door room.,High,Open,2024-11-17
T00884,P0098,E00162,Exactly per ground avoid heavy bill.,Medium,In Progress,2025-06-08
T00885,P0153,E00289,Call heart however life.,Medium,In Progress,2024-12-24
T00886,P0187,E00324,Admit fund save program fact cell.,Medium,In Progress,2025-04-05
T00887,P0047,E00303,Parent technology increase head life.,High,Blocked,2025-07-09
T00888,P0179,E00176,Color talk say speech.,High,In Progress,2025-03-09
T00889,P0017,E00487,Make drive fight book often final.,Low,Completed,2025-03-27
T00890,P0102,E00373,Claim other position truth modern spring yet.,Low,In Progress,2024-10-07
T00891,P0017,E00467,There dream class gas.,Low,Completed,2025-05-10
T00892,P0094,E00269,Future detail opportunity room skill pass sometimes.,High,In Progress,2025-06-06
T00893,P0109,E00072,We themselves process dinner.,Low,Blocked,2025-07-24
T00894,P0181,E00325,Baby nor beyond important.,Medium,Blocked,2025-03-06
T00895,P0145,E00240,Really table money policy.,Medium,Open,2025-08-21
T00896,P0082,E00483,Report forget build sing.,Low,Open,2025-07-10
T00897,P0045,E00354,Your ago beyond country mouth.,High,In Progress,2025-04-23
T00898,P0019,E00155,Reflect land south side.,Medium,Open,2024-10-18
T00899,P0119,E00030,Whether young decade follow reduce who determine.,Low,Completed,2024-10-06
T00900,P0139,E00369,Whether window particularly its present successful question.,Medium,Completed,2025-08-14
T00901,P0179,E00332,Church fill woman name herself describe.,Medium,Open,2025-04-12
T00902,P0051,E00095,Claim his agree air.,Medium,Completed,2025-03-21
T00903,P0166,E00256,Fire from big base practice.,High,Completed,2024-10-12
T00904,P0183,E00480,Finally talk indeed thought early tough bag.,Medium,Open,2024-12-03
T00905,P0123,E00158,Town work large simple since plant east.,Low,Blocked,2025-05-13
T00906,P0005,E00142,Sport also world less.,Low,In Progress,2024-12-31
T00907,P0164,E00153,Mrs civil art dog size pay series.,High,In Progress,2025-05-22
T00908,P0076,E00218,Science forget mean view.,High,Blocked,2025-05-02
T00909,P0066,E00192,What beautiful mind speech beat then manager wide.,Medium,Open,2024-10-23
T00910,P0151,E00056,Newspaper resource among when your as top foot.,High,Completed,2025-05-03
T00911,P0026,E00198,Model oil career.,High,Completed,2025-08-07
T00912,P0127,E00377,Organization rate quickly if.,Low,Open,2025-06-29
T00913,P0065,E00165,Attack him attention garden wind why quality.,Medium,In Progress,2025-04-15
T00914,P0150,E00274,Sort its if stuff recognize garden political.,High,Blocked,2024-12-13
T00915,P0170,E00120,Agree speech everybody.,Medium,Open,2025-06-23
T00916,P0124,E00297,The risk stand since force wall bank loss.,High,Open,2024-11-15
T00917,P0187,E00331,Listen door establish west hard itself.,Low,Open,2024-10-05
T00918,P0045,E00069,Tv stay mission wrong nor west attention.,Low,Completed,2025-03-21
T00919,P0022,E00101,End sense all seek ok especially same nice.,High,Completed,2025-09-14
T00920,P0119,E00408,Voice occur open look effect degree should.,High,Blocked,2025-09-09
T00921,P0151,E00162,Necessary loss open keep quality glass.,High,Completed,2025-04-04
T00922,P0143,E00033,Note until top produce.,Medium,Open,2025-01-18
T00923,P0084,E00261,Through soon idea security.,Low,Blocked,2025-03-02
T00924,P0156,E00420,Usually upon range blue.,High,In Progress,2025-01-02
T00925,P0072,E00399,Building despite eye believe.,Medium,Open,2025-01-23
T00926,P0174,E00374,Man drop beautiful before.,Medium,Open,2025-04-06
T00927,P0141,E00411,Lot year able dream suffer.,Low,In Progress,2024-12-21
T00928,P0159,E00025,News young concern store player top food wall.,Low,Open,2025-08-18
T00929,P0111,E00185,Amount model unit fear thousand while.,Medium,Open,2025-08-21
T00930,P0164,E00468,From same matter mouth try.,Medium,Completed,2025-08-30
T00931,P0011,E00395,Answer allow share sister night street career.,Medium,Completed,2025-05-18
T00932,P0172,E00008,Serious particularly few all.,Medium,Completed,2024-10-22
T00933,P0154,E00126,My after body catch future feeling.,Low,Open,2024-12-12
T00934,P0151,E00393,How staff ball return charge.,Medium,Blocked,2025-09-19
T00935,P0199,E00300,Tough crime involve no.,High,Open,2024-12-19
T00936,P0150,E00057,Shoulder door police two conference.,Medium,In Progress,2025-03-29
T00937,P0053,E00261,Hair light degree we.,Medium,Completed,2025-05-24
T00938,P0189,E00342,Keep simple among walk dark base somebody.,Medium,Blocked,2025-09-12
T00939,P0193,E00440,Quite standard dog tell under move.,High,In Progress,2025-05-11
T00940,P0065,E00172,Pretty nature cultural look seven reveal home in.,Low,Open,2025-07-27
T00941,P0012,E00071,Political interest eight order color test successful order.,Medium,Completed,2025-09-21
T00942,P0009,E00374,Expect only around late newspaper itself.,Medium,Blocked,2025-05-02
T00943,P0090,E00479,Interview century meet research.,Low,In Progress,2025-09-30
T00944,P0081,E00402,Off religious huge bag glass.,High,Blocked,2025-05-01
T00945,P0141,E00276,Agree maintain realize can thought most note.,Medium,Open,2025-06-23
T00946,P0058,E00306,Adult finish low human bit sister.,Low,Blocked,2025-07-01
T00947,P0088,E00474,General place gas pick.,Low,In Progress,2025-02-02
T00948,P0073,E00091,Meet grow night practice present size.,Medium,Completed,2025-05-06
