task_id,project_id,assignee_id,description,priority,status,due_date
T00949,P0123,E00336,Gas rock sing watch appear worker around most.,Medium,Completed,2025-01-07
T00950,P0148,E00163,Hard next fear authority throughout trouble.,Medium,Completed,2025-07-01
T00951,P0072,E00203,Particularly brother market green.,High,Open,2025-04-26
T00952,P0120,E00270,Simply space throw sing nice year yard.,Medium,In Progress,2025-03-31
T00953,P0184,E00358,Whether dream after speech message tax church.,High,Open,2025-01-23
T00954,P0167,E00169,Speak hard task activity beyond sit.,Medium,Blocked,2025-07-31
T00955,P0128,E00466,Serious early spend without off guy.,Low,In Progress,2025-01-10
T00956,P0001,E00244,Raise public big some reduce image.,Low,Completed,2025-03-14
T00957,P0040,E00070,Economy realize meet kind natural determine include.,Medium,Completed,2025-05-15
T00958,P0137,E00128,Trade get executive away in memory beat house.,Low,In Progress,2025-09-20
T00959,P0079,E00132,Soldier teach third career decade.,High,Open,2025-01-09
T00960,P0143,E00187,Interest detail different race PM.,Medium,Completed,2025-03-31
T00961,P0179,E00051,Lose live choice.,Medium,Open,2025-10-04
T00962,P0065,E00065,Analysis too view southern organization clear almost outside.,Medium,Open,2025-03-16
T00963,P0118,E00308,Make bar model west especially threat.,Low,In Progress,2024-11-19
T00964,P0013,E00218,Already actually reality scientist price hundred.,Low,Completed,2024-11-27
T00965,P0008,E00029,Alone compare likely artist.,Low,Open,2024-11-21
T00966,P0080,E00465,Operation television none federal.,Low,Blocked,2025-09-03
T00967,P0176,E00380,Final natural science skill.,High,In Progress,2025-06-15
T00968,P0069,E00196,Crime second force property career leave measure.,Medium,Open,2025-07-25
T00969,P0059,E00284,Else economy pressure wonder near manage nearly surface.,Medium,Open,2024-12-23
T00970,P0090,E00470,Option our require teacher reach.,Medium,In Progress,2024-12-26
T00971,P0123,E00182,Question Mr speech forget.,Low,Blocked,2024-10-20
T00972,P0149,E00128,Door environmental central report though edge.,Low,In Progress,2025-08-07
T00973,P0084,E00417,Nearly including popular between understand participant.,Low,In Progress,2025-09-19
T00974,P0069,E00309,Situation require pattern value idea.,Medium,Blocked,2024-12-01
T00975,P0022,E00403,Position modern price color everybody since cause buy.,Low,Blocked,2025-09-23
T00976,P0177,E00233,Door reveal month buy leave service.,Low,In Progress,2025-09-09
T00977,P0101,E00049,Read arrive computer build box media dark do.,Low,Open,2025-04-08
T00978,P0119,E00287,Western voice special break fact.,High,Open,2025-08-14
T00979,P0003,E00093,Several move focus.,Medium,In Progress,2025-04-06
T00980,P0079,E00379,Tonight whom site letter human ground only.,Low,In Progress,2025-07-27
T00981,P0007,E00201,Finally economy fish nearly.,Medium,Open,2024-10-06
T00982,P0073,E00384,City father let agreement official technology sort old.,Medium,In Progress,2024-12-23
T00983,P0060,E00226,Writer trade would their process stay skill.,Medium,Blocked,2025-06-28
T00984,P0093,E00467,Local century again check one ready floor marriage.,Low,Completed,2024-10-29
T00985,P0158,E00458,Affect factor over phone part.,Low,Open,2024-11-07
T00986,P0167,E00072,Issue become woman.,High,Open,2025-04-25
T00987,P0153,E00382,Shake power local idea.,Low,Completed,2025-06-10
T00988,P0049,E00174,Action home available interest consumer recently.,Medium,Completed,2025-04-06
T00989,P0046,E00048,Effort few record lot company.,High,Open,2025-04-06
T00990,P0021,E00442,Watch around take serious single.,High,In Progress,2025-06-25
T00991,P0116,E00232,Service ask if less coach use.,High,In Progress,2025-05-09
T00992,P0006,E00041,Take none also.,Low,Open,2025-09-04
T00993,P0033,E00439,Account husband now identify.,Low,Completed,2025-02-21
T00994,P0113,E00177,White management some notice meet small.,High,In Progress,2025-06-23
T00995,P0054,E00189,Else police political who.,Medium,In Progress,2024-12-15
T00996,P0195,E00460,By red trouble provide itself right.,Medium,Blocked,2024-12-19
T00997,P0118,E00480,Generation later tough must.,High,In Progress,2024-11-14
T00998,P0126,E00009,Service why rise wonder.,High,In Progress,2025-05-07
T00999,P0022,E00046,Against image financial.,High,Completed,2025-03-04
T01000,P0118,E00227,Bank Mrs and hold avoid cut.,Medium,In Progress,2025-08-04
